{
  "schema_version": 1,
  "diagram_type": "architecture",
  "meta": {
    "title": "同一个文件，三种不同口径",
    "locale": "zh-CN",
    "quality_profile": "showcase",
    "output": "experiments/binary-size-domains/domains.html",
    "legend": {
      "entries": {
        "backend": {
          "label": "静态记录"
        },
        "external": {
          "label": "未测量"
        }
      }
    }
  },
  "components": [
    {
      "id": "input",
      "label": "zero-1m",
      "pos": [
        320,
        40
      ],
      "size": [
        190,
        76
      ],
      "type": "backend",
      "icon": "none",
      "sublabel": "同一文件，三种读数"
    },
    {
      "id": "file",
      "label": "16,888 B",
      "pos": [
        40,
        190
      ],
      "size": [
        190,
        76
      ],
      "type": "backend",
      "icon": "none",
      "sublabel": "文件长度"
    },
    {
      "id": "total",
      "label": "4,296,048,640 B",
      "pos": [
        320,
        190
      ],
      "size": [
        190,
        76
      ],
      "type": "backend",
      "icon": "none",
      "sublabel": "size -m total"
    },
    {
      "id": "resident",
      "label": "未测量",
      "pos": [
        600,
        190
      ],
      "size": [
        190,
        76
      ],
      "type": "external",
      "icon": "none",
      "sublabel": "实际驻留内存（未运行）"
    },
    {
      "id": "guard",
      "label": "4,294,967,296 B",
      "pos": [
        180,
        340
      ],
      "size": [
        190,
        76
      ],
      "type": "backend",
      "icon": "none",
      "sublabel": "__PAGEZERO"
    },
    {
      "id": "permitted",
      "label": "1,081,344 B",
      "pos": [
        460,
        340
      ],
      "size": [
        190,
        76
      ],
      "type": "backend",
      "icon": "none",
      "sublabel": "其余三个段"
    }
  ],
  "connections": [
    {
      "id": "input-to-file",
      "from": "input",
      "to": "file",
      "label": "文件字节"
    },
    {
      "id": "input-to-total",
      "from": "input",
      "to": "total",
      "label": "静态报告"
    },
    {
      "id": "input-to-resident",
      "from": "input",
      "to": "resident",
      "label": "未运行"
    },
    {
      "id": "total-to-guard",
      "from": "total",
      "to": "guard",
      "label": "maxprot = 0"
    },
    {
      "id": "total-to-permitted",
      "from": "total",
      "to": "permitted",
      "label": "maxprot ≠ 0"
    }
  ]
}
