{
  "schema_version": 1,
  "diagram_type": "architecture",
  "meta": {
    "title": "昆明湖 V3 · DCache MainPipe 多请求流水",
    "locale": "zh-CN",
    "quality_profile": "showcase",
    "repository": {
      "url": "https://github.com/OpenXiangShan/XiangShan.git",
      "revision": "d48cd2dd79726c2d7a1264b3c7a50679c77461e2"
    },
    "legend": {
      "entries": {
        "backend": {
          "label": "数据通路 / 控制"
        },
        "database": {
          "label": "内部状态"
        },
        "messagebus": {
          "label": "队列 / 仲裁"
        },
        "security": {
          "label": "检查 / 恢复"
        },
        "external": {
          "label": "输入输出接口"
        }
      }
    },
    "output": ".archify/architecture-xiangshan-kunminghu-v3-full-20261013-152508/memory/dcache-main/dcache-main.html"
  },
  "components": [
    {
      "id": "n0",
      "type": "external",
      "label": "store请求门禁",
      "sublabel": "io.store_req.ready",
      "tag": "逻辑步骤",
      "pos": [
        80,
        70
      ],
      "size": [
        300,
        92
      ],
      "sources": [
        {
          "path": "src/main/scala/xiangshan/cache/dcache/mainpipe/MainPipe.scala",
          "line": 262,
          "end_line": 271,
          "label": "RTL · io.store_req.ready"
        }
      ]
    },
    {
      "id": "n1",
      "type": "backend",
      "label": "元数据/Tag访问",
      "sublabel": "io.meta_read.valid",
      "tag": "逻辑步骤",
      "pos": [
        80,
        280
      ],
      "size": [
        300,
        92
      ],
      "sources": [
        {
          "path": "src/main/scala/xiangshan/cache/dcache/mainpipe/MainPipe.scala",
          "line": 889,
          "end_line": 898,
          "label": "RTL · io.meta_read.valid"
        }
      ]
    },
    {
      "id": "n2",
      "type": "backend",
      "label": "数据读等待",
      "sublabel": "io.data_readline_can_go",
      "tag": "逻辑步骤",
      "pos": [
        80,
        490
      ],
      "size": [
        300,
        92
      ],
      "sources": [
        {
          "path": "src/main/scala/xiangshan/cache/dcache/mainpipe/MainPipe.scala",
          "line": 558,
          "end_line": 567,
          "label": "RTL · io.data_readline_can_go"
        }
      ]
    },
    {
      "id": "n3",
      "type": "backend",
      "label": "AMO运算",
      "sublabel": "val amoalu",
      "tag": "逻辑步骤",
      "pos": [
        80,
        700
      ],
      "size": [
        300,
        92
      ],
      "sources": [
        {
          "path": "src/main/scala/xiangshan/cache/dcache/mainpipe/MainPipe.scala",
          "line": 763,
          "end_line": 772,
          "label": "RTL · val amoalu"
        }
      ]
    },
    {
      "id": "n4",
      "type": "backend",
      "label": "LR/SC保留集",
      "sublabel": "io.lrsc_locked_block",
      "tag": "逻辑步骤",
      "pos": [
        80,
        910
      ],
      "size": [
        300,
        92
      ],
      "sources": [
        {
          "path": "src/main/scala/xiangshan/cache/dcache/mainpipe/MainPipe.scala",
          "line": 717,
          "end_line": 726,
          "label": "RTL · io.lrsc_locked_block"
        }
      ]
    },
    {
      "id": "n5",
      "type": "backend",
      "label": "元数据/数据更新",
      "sublabel": "io.data_write",
      "tag": "逻辑步骤",
      "pos": [
        80,
        1120
      ],
      "size": [
        300,
        92
      ],
      "sources": [
        {
          "path": "src/main/scala/xiangshan/cache/dcache/mainpipe/MainPipe.scala",
          "line": 824,
          "end_line": 833,
          "label": "RTL · io.data_write"
        }
      ]
    }
  ],
  "connections": [
    {
      "id": "dcache-main-step-0",
      "from": "n0",
      "to": "n1",
      "label": "数据 / 控制",
      "variant": "emphasis"
    },
    {
      "id": "dcache-main-step-1",
      "from": "n1",
      "to": "n2",
      "label": "数据 / 控制",
      "variant": "emphasis"
    },
    {
      "id": "dcache-main-step-2",
      "from": "n2",
      "to": "n3",
      "label": "数据 / 控制",
      "variant": "emphasis"
    },
    {
      "id": "dcache-main-step-3",
      "from": "n3",
      "to": "n4",
      "label": "数据 / 控制",
      "variant": "emphasis"
    },
    {
      "id": "dcache-main-step-4",
      "from": "n4",
      "to": "n5",
      "label": "数据 / 控制",
      "variant": "emphasis"
    }
  ],
  "cards": [
    {
      "dot": "cyan",
      "title": "设计职责",
      "items": [
        "仲裁store、refill、probe、replace与atomics请求，分阶段更新一致性元数据。",
        "LR/SC保留集影响probe和原子成功条件；AMO计算保留按字节写mask。",
        "读写阵列握手、release阻塞和错误路径均是实际流水条件。"
      ]
    },
    {
      "dot": "emerald",
      "title": "图中语义",
      "items": [
        "节点标注实际 RTL 信号或子模块；标记为“逻辑步骤”的框是组合/寄存器操作分组，并非额外硬件实例。",
        "沿连线阅读该模块的数据和控制依赖；流水级、同时执行及握手条件以节点和源码为准，图不是周期精确时序。"
      ]
    },
    {
      "dot": "violet",
      "title": "版本与配置",
      "items": [
        "top.DefaultConfig(1) · OpenLLC；xiangshan @ d48cd2dd7972",
        "角色、接口和状态根据固定 RTL 核实；多实例的同设计复用本页。",
        "实例数量由父模块/参数配置决定；本页描绘单实例的设计。"
      ]
    }
  ]
}
