{
  "schema_version": 1,
  "diagram_type": "architecture",
  "meta": {
    "title": "昆明湖 V3 · CommitQueue 已提交调用返回",
    "locale": "zh-CN",
    "quality_profile": "showcase",
    "repository": {
      "url": "https://github.com/OpenXiangShan/XiangShan.git",
      "revision": "d48cd2dd79726c2d7a1264b3c7a50679c77461e2"
    },
    "legend": {
      "entries": {
        "backend": {
          "label": "数据通路 / 控制"
        },
        "database": {
          "label": "内部状态"
        },
        "messagebus": {
          "label": "队列 / 仲裁"
        },
        "security": {
          "label": "检查 / 恢复"
        },
        "external": {
          "label": "输入输出接口"
        }
      }
    },
    "output": ".archify/architecture-xiangshan-kunminghu-v3-full-20261013-152508/frontend/commit-queue/commit-queue.html"
  },
  "components": [
    {
      "id": "n0",
      "type": "external",
      "label": "call/ret 提交",
      "sublabel": "class CommitQueueIO",
      "tag": "输入接口",
      "pos": [
        80,
        70
      ],
      "size": [
        300,
        92
      ],
      "sources": [
        {
          "path": "src/main/scala/xiangshan/frontend/ftq/CommitQueue.scala",
          "line": 27,
          "end_line": 36,
          "label": "RTL · class CommitQueueIO"
        }
      ]
    },
    {
      "id": "n1",
      "type": "database",
      "label": "提交记录队列",
      "sublabel": "private val mem",
      "tag": "内部状态",
      "pos": [
        80,
        280
      ],
      "size": [
        300,
        92
      ],
      "sources": [
        {
          "path": "src/main/scala/xiangshan/frontend/ftq/CommitQueue.scala",
          "line": 34,
          "end_line": 43,
          "label": "RTL · private val mem"
        }
      ]
    },
    {
      "id": "n2",
      "type": "backend",
      "label": "入队指针",
      "sublabel": "private val enqPtr",
      "tag": "逻辑步骤",
      "pos": [
        80,
        490
      ],
      "size": [
        300,
        92
      ],
      "sources": [
        {
          "path": "src/main/scala/xiangshan/frontend/ftq/CommitQueue.scala",
          "line": 36,
          "end_line": 45,
          "label": "RTL · private val enqPtr"
        }
      ]
    },
    {
      "id": "n3",
      "type": "backend",
      "label": "队头训练输出",
      "sublabel": "io.bpuTrain.valid",
      "tag": "逻辑步骤",
      "pos": [
        80,
        700
      ],
      "size": [
        300,
        92
      ],
      "sources": [
        {
          "path": "src/main/scala/xiangshan/frontend/ftq/CommitQueue.scala",
          "line": 62,
          "end_line": 71,
          "label": "RTL · io.bpuTrain.valid"
        }
      ]
    },
    {
      "id": "n4",
      "type": "backend",
      "label": "出队内容",
      "sublabel": "io.bpuTrain.bits",
      "tag": "逻辑步骤",
      "pos": [
        80,
        910
      ],
      "size": [
        300,
        92
      ],
      "sources": [
        {
          "path": "src/main/scala/xiangshan/frontend/ftq/CommitQueue.scala",
          "line": 63,
          "end_line": 71,
          "label": "RTL · io.bpuTrain.bits"
        }
      ]
    }
  ],
  "connections": [
    {
      "id": "commit-queue-step-0",
      "from": "n0",
      "to": "n1",
      "label": "数据 / 控制",
      "variant": "emphasis"
    },
    {
      "id": "commit-queue-step-1",
      "from": "n1",
      "to": "n2",
      "label": "数据 / 控制",
      "variant": "emphasis"
    },
    {
      "id": "commit-queue-step-2",
      "from": "n2",
      "to": "n3",
      "label": "数据 / 控制",
      "variant": "emphasis"
    },
    {
      "id": "commit-queue-step-3",
      "from": "n3",
      "to": "n4",
      "label": "数据 / 控制",
      "variant": "emphasis"
    }
  ],
  "cards": [
    {
      "dot": "cyan",
      "title": "设计职责",
      "items": [
        "64项缓存后端提交的 call/ret，供 RAS 提交状态更新。",
        "enq/deq 指针管理记录寿命；full 预留提交入口余量。",
        "这里只处理已提交信息，不替代 ResolveQueue 的方向/目标训练。"
      ]
    },
    {
      "dot": "emerald",
      "title": "图中语义",
      "items": [
        "节点标注实际 RTL 信号或子模块；标记为“逻辑步骤”的框是组合/寄存器操作分组，并非额外硬件实例。",
        "沿连线阅读该模块的数据和控制依赖；流水级、同时执行及握手条件以节点和源码为准，图不是周期精确时序。"
      ]
    },
    {
      "dot": "violet",
      "title": "版本与配置",
      "items": [
        "top.DefaultConfig(1) · OpenLLC；xiangshan @ d48cd2dd7972",
        "角色、接口和状态根据固定 RTL 核实；多实例的同设计复用本页。",
        "实例数量由父模块/参数配置决定；本页描绘单实例的设计。"
      ]
    }
  ]
}
