{
  "schema_version": 1,
  "diagram_type": "architecture",
  "meta": {
    "title": "昆明湖 V3 · VMove 向量与标量转移",
    "locale": "zh-CN",
    "quality_profile": "showcase",
    "repository": {
      "url": "https://github.com/OpenXiangShan/XiangShan.git",
      "revision": "d48cd2dd79726c2d7a1264b3c7a50679c77461e2"
    },
    "legend": {
      "entries": {
        "backend": {
          "label": "数据通路 / 控制"
        },
        "database": {
          "label": "内部状态"
        },
        "messagebus": {
          "label": "队列 / 仲裁"
        },
        "security": {
          "label": "检查 / 恢复"
        },
        "external": {
          "label": "输入输出接口"
        }
      }
    },
    "output": ".archify/architecture-xiangshan-kunminghu-v3-full-20261013-152508/backend/vector-move/vector-move.html"
  },
  "components": [
    {
      "id": "n0",
      "type": "external",
      "label": "move控制",
      "sublabel": "class",
      "tag": "逻辑步骤",
      "pos": [
        80,
        70
      ],
      "size": [
        300,
        92
      ],
      "sources": [
        {
          "path": "src/main/scala/xiangshan/backend/fu/wrapper/VMove.scala",
          "line": 15,
          "end_line": 24,
          "label": "RTL · class"
        }
      ]
    },
    {
      "id": "n1",
      "type": "backend",
      "label": "输入数据选择",
      "sublabel": "mod.io.in.bits.vs2",
      "tag": "逻辑步骤",
      "pos": [
        80,
        280
      ],
      "size": [
        300,
        92
      ],
      "sources": [
        {
          "path": "src/main/scala/xiangshan/backend/fu/wrapper/VMove.scala",
          "line": 33,
          "end_line": 42,
          "label": "RTL · mod.io.in.bits.vs2"
        }
      ]
    },
    {
      "id": "n2",
      "type": "backend",
      "label": "目的输出",
      "sublabel": "out",
      "tag": "逻辑步骤",
      "pos": [
        80,
        490
      ],
      "size": [
        300,
        92
      ],
      "sources": [
        {
          "path": "src/main/scala/xiangshan/backend/fu/wrapper/VMove.scala",
          "line": 38,
          "end_line": 47,
          "label": "RTL · out"
        }
      ]
    }
  ],
  "connections": [
    {
      "id": "vector-move-step-0",
      "from": "n0",
      "to": "n1",
      "label": "数据 / 控制",
      "variant": "emphasis"
    },
    {
      "id": "vector-move-step-1",
      "from": "n1",
      "to": "n2",
      "label": "数据 / 控制",
      "variant": "emphasis"
    }
  ],
  "cards": [
    {
      "dot": "cyan",
      "title": "设计职责",
      "items": [
        "区分标量到向量、向量到标量及数据组选择。",
        "SEW、uOP位置、mask/tail与目的类型影响实际写口。",
        "默认VmoveCfg位于VFEX0，与整数Move Elimination属于不同职责。"
      ]
    },
    {
      "dot": "emerald",
      "title": "图中语义",
      "items": [
        "节点标注实际 RTL 信号或子模块；标记为“逻辑步骤”的框是组合/寄存器操作分组，并非额外硬件实例。",
        "沿连线阅读该模块的数据和控制依赖；流水级、同时执行及握手条件以节点和源码为准，图不是周期精确时序。"
      ]
    },
    {
      "dot": "violet",
      "title": "版本与配置",
      "items": [
        "top.DefaultConfig(1) · OpenLLC；xiangshan @ d48cd2dd7972",
        "角色、接口和状态根据固定 RTL 核实；多实例的同设计复用本页。",
        "实例数量由父模块/参数配置决定；本页描绘单实例的设计。"
      ]
    }
  ]
}
