{
  "schema_version": 1,
  "diagram_type": "architecture",
  "meta": {
    "title": "昆明湖 V3 · LLC MainPipe Coherence动作",
    "locale": "zh-CN",
    "quality_profile": "showcase",
    "repository": {
      "url": "https://github.com/OpenXiangShan/XSCache.git",
      "revision": "300515bc7b2f65ca988041a984204489d80ec2fb"
    },
    "legend": {
      "entries": {
        "backend": {
          "label": "数据通路 / 控制"
        },
        "database": {
          "label": "内部状态"
        },
        "messagebus": {
          "label": "队列 / 仲裁"
        },
        "security": {
          "label": "检查 / 恢复"
        },
        "external": {
          "label": "输入输出接口"
        }
      }
    },
    "output": ".archify/architecture-xiangshan-kunminghu-v3-full-20261013-152508/memory/llc-main/llc-main.html"
  },
  "components": [
    {
      "id": "n0",
      "type": "external",
      "label": "总线/回填任务",
      "sublabel": "class MainPipe",
      "tag": "逻辑步骤",
      "pos": [
        80,
        70
      ],
      "size": [
        300,
        92
      ],
      "sources": [
        {
          "path": "src/main/scala/openLLC/MainPipe.scala",
          "line": 25,
          "end_line": 34,
          "label": "RTL · class MainPipe"
        }
      ]
    },
    {
      "id": "n1",
      "type": "backend",
      "label": "Self目录结果",
      "sublabel": "selfDirResp_s4",
      "tag": "逻辑步骤",
      "pos": [
        80,
        280
      ],
      "size": [
        300,
        92
      ],
      "sources": [
        {
          "path": "src/main/scala/openLLC/MainPipe.scala",
          "line": 264,
          "end_line": 273,
          "label": "RTL · selfDirResp_s4"
        }
      ]
    },
    {
      "id": "n2",
      "type": "backend",
      "label": "需要数据读",
      "sublabel": "io.toDS_s4.read.valid",
      "tag": "逻辑步骤",
      "pos": [
        80,
        490
      ],
      "size": [
        300,
        92
      ],
      "sources": [
        {
          "path": "src/main/scala/openLLC/MainPipe.scala",
          "line": 465,
          "end_line": 474,
          "label": "RTL · io.toDS_s4.read.valid"
        }
      ]
    },
    {
      "id": "n3",
      "type": "backend",
      "label": "回填写数据",
      "sublabel": "io.toDS_s4.write.valid",
      "tag": "逻辑步骤",
      "pos": [
        80,
        700
      ],
      "size": [
        300,
        92
      ],
      "sources": [
        {
          "path": "src/main/scala/openLLC/MainPipe.scala",
          "line": 468,
          "end_line": 477,
          "label": "RTL · io.toDS_s4.write.valid"
        }
      ]
    },
    {
      "id": "n4",
      "type": "backend",
      "label": "响应/内存任务",
      "sublabel": "io.toResponseUnit",
      "tag": "逻辑步骤",
      "pos": [
        80,
        910
      ],
      "size": [
        300,
        92
      ],
      "sources": [
        {
          "path": "src/main/scala/openLLC/MainPipe.scala",
          "line": 72,
          "end_line": 81,
          "label": "RTL · io.toResponseUnit"
        }
      ]
    }
  ],
  "connections": [
    {
      "id": "llc-main-step-0",
      "from": "n0",
      "to": "n1",
      "label": "数据 / 控制",
      "variant": "emphasis"
    },
    {
      "id": "llc-main-step-1",
      "from": "n1",
      "to": "n2",
      "label": "数据 / 控制",
      "variant": "emphasis"
    },
    {
      "id": "llc-main-step-2",
      "from": "n2",
      "to": "n3",
      "label": "数据 / 控制",
      "variant": "emphasis"
    },
    {
      "id": "llc-main-step-3",
      "from": "n3",
      "to": "n4",
      "label": "数据 / 控制",
      "variant": "emphasis"
    }
  ],
  "cards": [
    {
      "dot": "cyan",
      "title": "设计职责",
      "items": [
        "根据Self/Client目录和CHI opcode决定snoop、memory、response和refill任务。",
        "数据未就绪、脏行清理和回填写都有明确条件。",
        "命中并不意味着可立即响应，客户端脏数据可能需snoop获取。"
      ]
    },
    {
      "dot": "emerald",
      "title": "图中语义",
      "items": [
        "节点标注实际 RTL 信号或子模块；标记为“逻辑步骤”的框是组合/寄存器操作分组，并非额外硬件实例。",
        "沿连线阅读该模块的数据和控制依赖；流水级、同时执行及握手条件以节点和源码为准，图不是周期精确时序。"
      ]
    },
    {
      "dot": "violet",
      "title": "版本与配置",
      "items": [
        "top.DefaultConfig(1) · OpenLLC；xscache @ 300515bc7b2f",
        "角色、接口和状态根据固定 RTL 核实；多实例的同设计复用本页。",
        "实例数量由父模块/参数配置决定；本页描绘单实例的设计。"
      ]
    }
  ]
}
