{
  "schema_version": 1,
  "diagram_type": "architecture",
  "meta": {
    "title": "昆明湖 V3 · BKU 位操作/密码运算",
    "locale": "zh-CN",
    "quality_profile": "showcase",
    "repository": {
      "url": "https://github.com/OpenXiangShan/XiangShan.git",
      "revision": "d48cd2dd79726c2d7a1264b3c7a50679c77461e2"
    },
    "legend": {
      "entries": {
        "backend": {
          "label": "数据通路 / 控制"
        },
        "database": {
          "label": "内部状态"
        },
        "messagebus": {
          "label": "队列 / 仲裁"
        },
        "security": {
          "label": "检查 / 恢复"
        },
        "external": {
          "label": "输入输出接口"
        }
      }
    },
    "output": ".archify/architecture-xiangshan-kunminghu-v3-full-20261013-152508/backend/bit-crypto/bit-crypto.html"
  },
  "components": [
    {
      "id": "n0",
      "type": "external",
      "label": "计数/零检测",
      "sublabel": "val countModule",
      "tag": "硬件实例",
      "pos": [
        560,
        70
      ],
      "size": [
        300,
        92
      ],
      "sources": [
        {
          "path": "src/main/scala/xiangshan/backend/fu/Bku.scala",
          "line": 329,
          "end_line": 338,
          "label": "RTL · val countModule"
        }
      ]
    },
    {
      "id": "n1",
      "type": "backend",
      "label": "无进位乘",
      "sublabel": "val clmulModule",
      "tag": "硬件实例",
      "pos": [
        560,
        280
      ],
      "size": [
        300,
        92
      ],
      "sources": [
        {
          "path": "src/main/scala/xiangshan/backend/fu/Bku.scala",
          "line": 334,
          "end_line": 343,
          "label": "RTL · val clmulModule"
        }
      ]
    },
    {
      "id": "n2",
      "type": "backend",
      "label": "Hash运算",
      "sublabel": "val hashModule",
      "tag": "硬件实例",
      "pos": [
        560,
        490
      ],
      "size": [
        300,
        92
      ],
      "sources": [
        {
          "path": "src/main/scala/xiangshan/backend/fu/Bku.scala",
          "line": 305,
          "end_line": 314,
          "label": "RTL · val hashModule"
        }
      ]
    },
    {
      "id": "n3",
      "type": "backend",
      "label": "BlockCipher",
      "sublabel": "val blockCipherModule",
      "tag": "硬件实例",
      "pos": [
        560,
        700
      ],
      "size": [
        300,
        92
      ],
      "sources": [
        {
          "path": "src/main/scala/xiangshan/backend/fu/Bku.scala",
          "line": 310,
          "end_line": 319,
          "label": "RTL · val blockCipherModule"
        }
      ]
    },
    {
      "id": "n4",
      "type": "backend",
      "label": "Crypto结果",
      "sublabel": "io.out := Mux(funcReg(4)",
      "tag": "逻辑步骤",
      "pos": [
        560,
        910
      ],
      "size": [
        300,
        92
      ],
      "sources": [
        {
          "path": "src/main/scala/xiangshan/backend/fu/Bku.scala",
          "line": 316,
          "end_line": 325,
          "label": "RTL · io.out := Mux(funcReg(4)"
        }
      ]
    },
    {
      "id": "owner",
      "type": "backend",
      "label": "模块内部设计",
      "sublabel": "bit-crypto",
      "tag": "结构视图",
      "pos": [
        80,
        490
      ],
      "size": [
        300,
        92
      ],
      "sources": [
        {
          "path": "src/main/scala/xiangshan/backend/fu/Bku.scala",
          "line": 329,
          "end_line": 338,
          "label": "RTL · val countModule"
        }
      ]
    }
  ],
  "connections": [
    {
      "id": "bit-crypto-owns-n0",
      "from": "owner",
      "to": "n0",
      "label": "结构角色",
      "variant": "default"
    },
    {
      "id": "bit-crypto-owns-n1",
      "from": "owner",
      "to": "n1",
      "label": "结构角色",
      "variant": "default"
    },
    {
      "id": "bit-crypto-owns-n2",
      "from": "owner",
      "to": "n2",
      "label": "结构角色",
      "variant": "default"
    },
    {
      "id": "bit-crypto-owns-n3",
      "from": "owner",
      "to": "n3",
      "label": "结构角色",
      "variant": "default"
    },
    {
      "id": "bit-crypto-owns-n4",
      "from": "owner",
      "to": "n4",
      "label": "结构角色",
      "variant": "default"
    }
  ],
  "cards": [
    {
      "dot": "cyan",
      "title": "设计职责",
      "items": [
        "BKU包括Count、Clmul、Misc和Crypto，按func选择。",
        "SHA/SM3和AES/SM4是不同数据通路，不能当作都串行执行。",
        "regEnable/流水控制保留，复杂共用原语不单独画为架构模块。"
      ]
    },
    {
      "dot": "emerald",
      "title": "图中语义",
      "items": [
        "节点标注实际 RTL 信号或子模块；标记为“逻辑步骤”的框是组合/寄存器操作分组，并非额外硬件实例。",
        "本页按模块结构角色展开，连线表示组成/控制关联；并行子单元之间不串接。实际I/O主路径在父图或相应细节页。"
      ]
    },
    {
      "dot": "violet",
      "title": "版本与配置",
      "items": [
        "top.DefaultConfig(1) · OpenLLC；xiangshan @ d48cd2dd7972",
        "角色、接口和状态根据固定 RTL 核实；多实例的同设计复用本页。",
        "实例数量由父模块/参数配置决定；本页描绘单实例的设计。"
      ]
    }
  ]
}
