{
  "schema_version": 1,
  "diagram_type": "architecture",
  "meta": {
    "title": "昆明湖 V3 · ICache 单 MSHR",
    "locale": "zh-CN",
    "quality_profile": "showcase",
    "repository": {
      "url": "https://github.com/OpenXiangShan/XiangShan.git",
      "revision": "d48cd2dd79726c2d7a1264b3c7a50679c77461e2"
    },
    "legend": {
      "entries": {
        "backend": {
          "label": "数据通路 / 控制"
        },
        "database": {
          "label": "内部状态"
        },
        "messagebus": {
          "label": "队列 / 仲裁"
        },
        "security": {
          "label": "检查 / 恢复"
        },
        "external": {
          "label": "输入输出接口"
        }
      }
    },
    "output": ".archify/architecture-xiangshan-kunminghu-v3-full-20261013-152508/frontend/icache-mshr/icache-mshr.html"
  },
  "components": [
    {
      "id": "n0",
      "type": "external",
      "label": "空闲接收门禁",
      "sublabel": "io.req.ready",
      "tag": "逻辑步骤",
      "pos": [
        80,
        70
      ],
      "size": [
        300,
        92
      ],
      "sources": [
        {
          "path": "src/main/scala/xiangshan/frontend/icache/ICacheMshr.scala",
          "line": 95,
          "end_line": 104,
          "label": "RTL · io.req.ready"
        }
      ]
    },
    {
      "id": "n1",
      "type": "database",
      "label": "请求有效状态",
      "sublabel": "valid",
      "tag": "逻辑步骤",
      "pos": [
        80,
        280
      ],
      "size": [
        300,
        92
      ],
      "sources": [
        {
          "path": "src/main/scala/xiangshan/frontend/icache/ICacheMshr.scala",
          "line": 47,
          "end_line": 56,
          "label": "RTL · valid"
        }
      ]
    },
    {
      "id": "n2",
      "type": "backend",
      "label": "总线发出条件",
      "sublabel": "io.acquire.valid",
      "tag": "逻辑步骤",
      "pos": [
        80,
        490
      ],
      "size": [
        300,
        92
      ],
      "sources": [
        {
          "path": "src/main/scala/xiangshan/frontend/icache/ICacheMshr.scala",
          "line": 106,
          "end_line": 115,
          "label": "RTL · io.acquire.valid"
        }
      ]
    },
    {
      "id": "n3",
      "type": "backend",
      "label": "GetBlock 地址",
      "sublabel": "getBlock",
      "tag": "逻辑步骤",
      "pos": [
        80,
        700
      ],
      "size": [
        300,
        92
      ],
      "sources": [
        {
          "path": "src/main/scala/xiangshan/frontend/icache/ICacheMshr.scala",
          "line": 107,
          "end_line": 116,
          "label": "RTL · getBlock"
        }
      ]
    },
    {
      "id": "n4",
      "type": "backend",
      "label": "回填信息",
      "sublabel": "io.info.valid",
      "tag": "逻辑步骤",
      "pos": [
        80,
        910
      ],
      "size": [
        300,
        92
      ],
      "sources": [
        {
          "path": "src/main/scala/xiangshan/frontend/icache/ICacheMshr.scala",
          "line": 136,
          "end_line": 145,
          "label": "RTL · io.info.valid"
        }
      ]
    },
    {
      "id": "n5",
      "type": "backend",
      "label": "WFI 安全反馈",
      "sublabel": "io.wfi.wfiSafe",
      "tag": "逻辑步骤",
      "pos": [
        80,
        1120
      ],
      "size": [
        300,
        92
      ],
      "sources": [
        {
          "path": "src/main/scala/xiangshan/frontend/icache/ICacheMshr.scala",
          "line": 142,
          "end_line": 151,
          "label": "RTL · io.wfi.wfiSafe"
        }
      ]
    }
  ],
  "connections": [
    {
      "id": "icache-mshr-step-0",
      "from": "n0",
      "to": "n1",
      "label": "数据 / 控制",
      "variant": "emphasis"
    },
    {
      "id": "icache-mshr-step-1",
      "from": "n1",
      "to": "n2",
      "label": "数据 / 控制",
      "variant": "emphasis"
    },
    {
      "id": "icache-mshr-step-2",
      "from": "n2",
      "to": "n3",
      "label": "数据 / 控制",
      "variant": "emphasis"
    },
    {
      "id": "icache-mshr-step-3",
      "from": "n3",
      "to": "n4",
      "label": "数据 / 控制",
      "variant": "emphasis"
    },
    {
      "id": "icache-mshr-step-4",
      "from": "n4",
      "to": "n5",
      "label": "数据 / 控制",
      "variant": "emphasis"
    }
  ],
  "cards": [
    {
      "dot": "cyan",
      "title": "设计职责",
      "items": [
        "valid/issue 分别记录占用和总线事务已发出。",
        "flush/fence.i 阻止错误请求发布，未返回的已发事务仍影响 WFI safe。",
        "单实例逻辑复用于 fetch 与 prefetch，冲刷策略在父 MissUnit 按类型区分。"
      ]
    },
    {
      "dot": "emerald",
      "title": "图中语义",
      "items": [
        "节点标注实际 RTL 信号或子模块；标记为“逻辑步骤”的框是组合/寄存器操作分组，并非额外硬件实例。",
        "沿连线阅读该模块的数据和控制依赖；流水级、同时执行及握手条件以节点和源码为准，图不是周期精确时序。"
      ]
    },
    {
      "dot": "violet",
      "title": "版本与配置",
      "items": [
        "top.DefaultConfig(1) · OpenLLC；xiangshan @ d48cd2dd7972",
        "角色、接口和状态根据固定 RTL 核实；多实例的同设计复用本页。",
        "实例数量由父模块/参数配置决定；本页描绘单实例的设计。"
      ]
    }
  ]
}
