{
  "schema_version": 1,
  "diagram_type": "architecture",
  "meta": {
    "title": "昆明湖 V3 · ALU 并行结果选择",
    "locale": "zh-CN",
    "quality_profile": "showcase",
    "repository": {
      "url": "https://github.com/OpenXiangShan/XiangShan.git",
      "revision": "d48cd2dd79726c2d7a1264b3c7a50679c77461e2"
    },
    "legend": {
      "entries": {
        "backend": {
          "label": "数据通路 / 控制"
        },
        "database": {
          "label": "内部状态"
        },
        "messagebus": {
          "label": "队列 / 仲裁"
        },
        "security": {
          "label": "检查 / 恢复"
        },
        "external": {
          "label": "输入输出接口"
        }
      }
    },
    "output": ".archify/architecture-xiangshan-kunminghu-v3-full-20261013-152508/backend/alu/alu.html"
  },
  "components": [
    {
      "id": "n0",
      "type": "external",
      "label": "源操作数/功能码",
      "sublabel": "val addSrc2",
      "tag": "逻辑步骤",
      "pos": [
        80,
        70
      ],
      "size": [
        300,
        92
      ],
      "sources": [
        {
          "path": "src/main/scala/xiangshan/backend/fu/Alu.scala",
          "line": 302,
          "end_line": 311,
          "label": "RTL · val addSrc2"
        }
      ]
    },
    {
      "id": "n1",
      "type": "backend",
      "label": "加减与比较",
      "sublabel": "val subModule",
      "tag": "逻辑步骤",
      "pos": [
        80,
        280
      ],
      "size": [
        300,
        92
      ],
      "sources": [
        {
          "path": "src/main/scala/xiangshan/backend/fu/Alu.scala",
          "line": 265,
          "end_line": 274,
          "label": "RTL · val subModule"
        }
      ]
    },
    {
      "id": "n2",
      "type": "backend",
      "label": "移位/旋转",
      "sublabel": "val leftShiftWordModule",
      "tag": "逻辑步骤",
      "pos": [
        80,
        490
      ],
      "size": [
        300,
        92
      ],
      "sources": [
        {
          "path": "src/main/scala/xiangshan/backend/fu/Alu.scala",
          "line": 270,
          "end_line": 279,
          "label": "RTL · val leftShiftWordModule"
        }
      ]
    },
    {
      "id": "n3",
      "type": "backend",
      "label": "逻辑/打包",
      "sublabel": "val logicSrc2",
      "tag": "逻辑步骤",
      "pos": [
        80,
        700
      ],
      "size": [
        300,
        92
      ],
      "sources": [
        {
          "path": "src/main/scala/xiangshan/backend/fu/Alu.scala",
          "line": 340,
          "end_line": 349,
          "label": "RTL · val logicSrc2"
        }
      ]
    },
    {
      "id": "n4",
      "type": "backend",
      "label": "条件置零",
      "sublabel": "val condModule",
      "tag": "逻辑步骤",
      "pos": [
        80,
        910
      ],
      "size": [
        300,
        92
      ],
      "sources": [
        {
          "path": "src/main/scala/xiangshan/backend/fu/Alu.scala",
          "line": 375,
          "end_line": 384,
          "label": "RTL · val condModule"
        }
      ]
    },
    {
      "id": "n5",
      "type": "backend",
      "label": "结果仲裁",
      "sublabel": "io.result := aluRes",
      "tag": "逻辑步骤",
      "pos": [
        80,
        1120
      ],
      "size": [
        300,
        92
      ],
      "sources": [
        {
          "path": "src/main/scala/xiangshan/backend/fu/Alu.scala",
          "line": 437,
          "end_line": 446,
          "label": "RTL · io.result := aluRes"
        }
      ]
    }
  ],
  "connections": [
    {
      "id": "alu-step-0",
      "from": "n0",
      "to": "n1",
      "label": "数据 / 控制",
      "variant": "emphasis"
    },
    {
      "id": "alu-step-1",
      "from": "n1",
      "to": "n2",
      "label": "数据 / 控制",
      "variant": "emphasis"
    },
    {
      "id": "alu-step-2",
      "from": "n2",
      "to": "n3",
      "label": "数据 / 控制",
      "variant": "emphasis"
    },
    {
      "id": "alu-step-3",
      "from": "n3",
      "to": "n4",
      "label": "数据 / 控制",
      "variant": "emphasis"
    },
    {
      "id": "alu-step-4",
      "from": "n4",
      "to": "n5",
      "label": "数据 / 控制",
      "variant": "emphasis"
    }
  ],
  "cards": [
    {
      "dot": "cyan",
      "title": "设计职责",
      "items": [
        "6个ALU执行配置复用整数ALU设计，各自还带不同附属FU。",
        "加减、移位、旋转、比较和bit逻辑并行计算，opcode选最终结果。",
        "W类操作、符号扩展和特殊融合操作的输入变换保持。"
      ]
    },
    {
      "dot": "emerald",
      "title": "图中语义",
      "items": [
        "节点标注实际 RTL 信号或子模块；标记为“逻辑步骤”的框是组合/寄存器操作分组，并非额外硬件实例。",
        "沿连线阅读该模块的数据和控制依赖；流水级、同时执行及握手条件以节点和源码为准，图不是周期精确时序。"
      ]
    },
    {
      "dot": "violet",
      "title": "版本与配置",
      "items": [
        "top.DefaultConfig(1) · OpenLLC；xiangshan @ d48cd2dd7972",
        "角色、接口和状态根据固定 RTL 核实；多实例的同设计复用本页。",
        "实例数量由父模块/参数配置决定；本页描绘单实例的设计。"
      ]
    }
  ]
}
