{
  "schema_version": 1,
  "diagram_type": "architecture",
  "meta": {
    "title": "昆明湖 V3 · VCVTWrapper widen/narrow转换",
    "locale": "zh-CN",
    "quality_profile": "showcase",
    "repository": {
      "url": "https://github.com/OpenXiangShan/XiangShan.git",
      "revision": "d48cd2dd79726c2d7a1264b3c7a50679c77461e2"
    },
    "legend": {
      "entries": {
        "backend": {
          "label": "数据通路 / 控制"
        },
        "database": {
          "label": "内部状态"
        },
        "messagebus": {
          "label": "队列 / 仲裁"
        },
        "security": {
          "label": "检查 / 恢复"
        },
        "external": {
          "label": "输入输出接口"
        }
      }
    },
    "output": ".archify/architecture-xiangshan-kunminghu-v3-full-20261013-152508/backend/vector-cvt/vector-cvt.html"
  },
  "components": [
    {
      "id": "n0",
      "type": "external",
      "label": "输入输出宽度",
      "sublabel": "private val ex0NextInWidth",
      "tag": "逻辑步骤",
      "pos": [
        80,
        70
      ],
      "size": [
        300,
        92
      ],
      "sources": [
        {
          "path": "src/main/scala/xiangshan/backend/fu/wrapper/VCVTWrapper.scala",
          "line": 27,
          "end_line": 36,
          "label": "RTL · private val ex0NextInWidth"
        }
      ]
    },
    {
      "id": "n1",
      "type": "backend",
      "label": "widen/narrow模式",
      "sublabel": "private val ex0NextIsNarrow",
      "tag": "逻辑步骤",
      "pos": [
        80,
        280
      ],
      "size": [
        300,
        92
      ],
      "sources": [
        {
          "path": "src/main/scala/xiangshan/backend/fu/wrapper/VCVTWrapper.scala",
          "line": 42,
          "end_line": 51,
          "label": "RTL · private val ex0NextIsNarrow"
        }
      ]
    },
    {
      "id": "n2",
      "type": "backend",
      "label": "VectorCvt内核",
      "sublabel": "private val vfcvts",
      "tag": "硬件实例",
      "pos": [
        80,
        490
      ],
      "size": [
        300,
        92
      ],
      "sources": [
        {
          "path": "src/main/scala/xiangshan/backend/fu/wrapper/VCVTWrapper.scala",
          "line": 57,
          "end_line": 66,
          "label": "RTL · private val vfcvts"
        }
      ]
    },
    {
      "id": "n3",
      "type": "backend",
      "label": "lane拆分",
      "sublabel": "private val vs2Split",
      "tag": "逻辑步骤",
      "pos": [
        80,
        700
      ],
      "size": [
        300,
        92
      ],
      "sources": [
        {
          "path": "src/main/scala/xiangshan/backend/fu/wrapper/VCVTWrapper.scala",
          "line": 58,
          "end_line": 67,
          "label": "RTL · private val vs2Split"
        }
      ]
    },
    {
      "id": "n4",
      "type": "backend",
      "label": "结果flags",
      "sublabel": "fflags",
      "tag": "逻辑步骤",
      "pos": [
        80,
        910
      ],
      "size": [
        300,
        92
      ],
      "sources": [
        {
          "path": "src/main/scala/xiangshan/backend/fu/wrapper/VCVTWrapper.scala",
          "line": 105,
          "end_line": 114,
          "label": "RTL · fflags"
        }
      ]
    }
  ],
  "connections": [
    {
      "id": "vector-cvt-step-0",
      "from": "n0",
      "to": "n1",
      "label": "数据 / 控制",
      "variant": "emphasis"
    },
    {
      "id": "vector-cvt-step-1",
      "from": "n1",
      "to": "n2",
      "label": "数据 / 控制",
      "variant": "emphasis"
    },
    {
      "id": "vector-cvt-step-2",
      "from": "n2",
      "to": "n3",
      "label": "数据 / 控制",
      "variant": "emphasis"
    },
    {
      "id": "vector-cvt-step-3",
      "from": "n3",
      "to": "n4",
      "label": "数据 / 控制",
      "variant": "emphasis"
    }
  ],
  "cards": [
    {
      "dot": "cyan",
      "title": "设计职责",
      "items": [
        "VFEX0具有VfcvtCfg，来源宽度、目标宽度和uopIdx决定lane分组。",
        "widen与narrow处理不同源分段和目的位置。",
        "按活跃元素聚合fflags，非活跃mask/tail元素不形成错误的新异常。"
      ]
    },
    {
      "dot": "emerald",
      "title": "图中语义",
      "items": [
        "节点标注实际 RTL 信号或子模块；标记为“逻辑步骤”的框是组合/寄存器操作分组，并非额外硬件实例。",
        "沿连线阅读该模块的数据和控制依赖；流水级、同时执行及握手条件以节点和源码为准，图不是周期精确时序。"
      ]
    },
    {
      "dot": "violet",
      "title": "版本与配置",
      "items": [
        "top.DefaultConfig(1) · OpenLLC；xiangshan @ d48cd2dd7972",
        "角色、接口和状态根据固定 RTL 核实；多实例的同设计复用本页。",
        "实例数量由父模块/参数配置决定；本页描绘单实例的设计。"
      ]
    }
  ]
}
