{
  "schema_version": 1,
  "diagram_type": "architecture",
  "meta": {
    "title": "昆明湖 V3 · ResolveQueue 合并与训练",
    "locale": "zh-CN",
    "quality_profile": "showcase",
    "repository": {
      "url": "https://github.com/OpenXiangShan/XiangShan.git",
      "revision": "d48cd2dd79726c2d7a1264b3c7a50679c77461e2"
    },
    "legend": {
      "entries": {
        "backend": {
          "label": "数据通路 / 控制"
        },
        "database": {
          "label": "内部状态"
        },
        "messagebus": {
          "label": "队列 / 仲裁"
        },
        "security": {
          "label": "检查 / 恢复"
        },
        "external": {
          "label": "输入输出接口"
        }
      }
    },
    "output": ".archify/architecture-xiangshan-kunminghu-v3-full-20261013-152508/frontend/resolve-queue/resolve-queue.html"
  },
  "components": [
    {
      "id": "n0",
      "type": "external",
      "label": "解析记录",
      "sublabel": "class ResolveWithSource",
      "tag": "输入接口",
      "pos": [
        80,
        70
      ],
      "size": [
        300,
        92
      ],
      "sources": [
        {
          "path": "src/main/scala/xiangshan/frontend/ftq/ResolveQueue.scala",
          "line": 67,
          "end_line": 76,
          "label": "RTL · class ResolveWithSource"
        }
      ]
    },
    {
      "id": "n1",
      "type": "database",
      "label": "队列项状态",
      "sublabel": "private val mem",
      "tag": "内部状态",
      "pos": [
        80,
        280
      ],
      "size": [
        300,
        92
      ],
      "sources": [
        {
          "path": "src/main/scala/xiangshan/frontend/ftq/ResolveQueue.scala",
          "line": 42,
          "end_line": 51,
          "label": "RTL · private val mem"
        }
      ]
    },
    {
      "id": "n2",
      "type": "backend",
      "label": "入队索引",
      "sublabel": "private val enqIndex",
      "tag": "逻辑步骤",
      "pos": [
        80,
        490
      ],
      "size": [
        300,
        92
      ],
      "sources": [
        {
          "path": "src/main/scala/xiangshan/frontend/ftq/ResolveQueue.scala",
          "line": 119,
          "end_line": 128,
          "label": "RTL · private val enqIndex"
        }
      ]
    },
    {
      "id": "n3",
      "type": "backend",
      "label": "训练出队",
      "sublabel": "io.bpuTrain.valid",
      "tag": "逻辑步骤",
      "pos": [
        80,
        700
      ],
      "size": [
        300,
        92
      ],
      "sources": [
        {
          "path": "src/main/scala/xiangshan/frontend/ftq/ResolveQueue.scala",
          "line": 167,
          "end_line": 176,
          "label": "RTL · io.bpuTrain.valid"
        }
      ]
    },
    {
      "id": "n4",
      "type": "backend",
      "label": "跳过已冲刷项",
      "sublabel": "when(io.bpuTrain.fire",
      "tag": "逻辑步骤",
      "pos": [
        80,
        910
      ],
      "size": [
        300,
        92
      ],
      "sources": [
        {
          "path": "src/main/scala/xiangshan/frontend/ftq/ResolveQueue.scala",
          "line": 170,
          "end_line": 179,
          "label": "RTL · when(io.bpuTrain.fire"
        }
      ]
    }
  ],
  "connections": [
    {
      "id": "resolve-queue-step-0",
      "from": "n0",
      "to": "n1",
      "label": "数据 / 控制",
      "variant": "emphasis"
    },
    {
      "id": "resolve-queue-step-1",
      "from": "n1",
      "to": "n2",
      "label": "数据 / 控制",
      "variant": "emphasis"
    },
    {
      "id": "resolve-queue-step-2",
      "from": "n2",
      "to": "n3",
      "label": "数据 / 控制",
      "variant": "emphasis"
    },
    {
      "id": "resolve-queue-step-3",
      "from": "n3",
      "to": "n4",
      "label": "数据 / 控制",
      "variant": "emphasis"
    }
  ],
  "cards": [
    {
      "dot": "cyan",
      "title": "设计职责",
      "items": [
        "默认16项，按 FTQ 索引合并分支解析信息，并标记 flushed。",
        "有效未冲刷队头发往 BPU；消费或跳过 flushed 项推动 deqPtr。",
        "full 保留入口余量，redirect 与覆盖不能把年轻错误路径当有效训练。"
      ]
    },
    {
      "dot": "emerald",
      "title": "图中语义",
      "items": [
        "节点标注实际 RTL 信号或子模块；标记为“逻辑步骤”的框是组合/寄存器操作分组，并非额外硬件实例。",
        "沿连线阅读该模块的数据和控制依赖；流水级、同时执行及握手条件以节点和源码为准，图不是周期精确时序。"
      ]
    },
    {
      "dot": "violet",
      "title": "版本与配置",
      "items": [
        "top.DefaultConfig(1) · OpenLLC；xiangshan @ d48cd2dd7972",
        "角色、接口和状态根据固定 RTL 核实；多实例的同设计复用本页。",
        "实例数量由父模块/参数配置决定；本页描绘单实例的设计。"
      ]
    }
  ]
}
