{
  "schema_version": 1,
  "diagram_type": "architecture",
  "meta": {
    "title": "昆明湖 V3 · ROB 压缩组装与例外",
    "locale": "zh-CN",
    "quality_profile": "showcase",
    "repository": {
      "url": "https://github.com/OpenXiangShan/XiangShan.git",
      "revision": "d48cd2dd79726c2d7a1264b3c7a50679c77461e2"
    },
    "legend": {
      "entries": {
        "backend": {
          "label": "数据通路 / 控制"
        },
        "database": {
          "label": "内部状态"
        },
        "messagebus": {
          "label": "队列 / 仲裁"
        },
        "security": {
          "label": "检查 / 恢复"
        },
        "external": {
          "label": "输入输出接口"
        }
      }
    },
    "output": ".archify/architecture-xiangshan-kunminghu-v3-full-20261013-152508/backend/rob-compression/rob-compression.html"
  },
  "components": [
    {
      "id": "n0",
      "type": "external",
      "label": "架构/实际 uOP 有效",
      "sublabel": "val actualValidVec",
      "tag": "逻辑步骤",
      "pos": [
        80,
        70
      ],
      "size": [
        300,
        92
      ],
      "sources": [
        {
          "path": "src/main/scala/xiangshan/backend/rename/CompressUnit.scala",
          "line": 127,
          "end_line": 136,
          "label": "RTL · val actualValidVec"
        }
      ]
    },
    {
      "id": "n1",
      "type": "backend",
      "label": "禁止压缩分类",
      "sublabel": "val cannotCompressVec",
      "tag": "逻辑步骤",
      "pos": [
        80,
        280
      ],
      "size": [
        300,
        92
      ],
      "sources": [
        {
          "path": "src/main/scala/xiangshan/backend/rename/CompressUnit.scala",
          "line": 104,
          "end_line": 113,
          "label": "RTL · val cannotCompressVec"
        }
      ]
    },
    {
      "id": "n2",
      "type": "backend",
      "label": "simple/complex 分组",
      "sublabel": "val simpleVec",
      "tag": "逻辑步骤",
      "pos": [
        80,
        490
      ],
      "size": [
        300,
        92
      ],
      "sources": [
        {
          "path": "src/main/scala/xiangshan/backend/rename/CompressUnit.scala",
          "line": 141,
          "end_line": 150,
          "label": "RTL · val simpleVec"
        }
      ]
    },
    {
      "id": "n3",
      "type": "backend",
      "label": "token 边界",
      "sublabel": "val tokenStart",
      "tag": "逻辑步骤",
      "pos": [
        80,
        700
      ],
      "size": [
        300,
        92
      ],
      "sources": [
        {
          "path": "src/main/scala/xiangshan/backend/rename/CompressUnit.scala",
          "line": 149,
          "end_line": 158,
          "label": "RTL · val tokenStart"
        }
      ]
    },
    {
      "id": "n4",
      "type": "backend",
      "label": "prefix 配对状态",
      "sublabel": "var pairStatePrefix",
      "tag": "逻辑步骤",
      "pos": [
        80,
        910
      ],
      "size": [
        300,
        92
      ],
      "sources": [
        {
          "path": "src/main/scala/xiangshan/backend/rename/CompressUnit.scala",
          "line": 177,
          "end_line": 186,
          "label": "RTL · var pairStatePrefix"
        }
      ]
    },
    {
      "id": "n5",
      "type": "backend",
      "label": "entry 成员输出",
      "sublabel": "io.out.isEntryTailLane",
      "tag": "逻辑步骤",
      "pos": [
        80,
        1120
      ],
      "size": [
        300,
        92
      ],
      "sources": [
        {
          "path": "src/main/scala/xiangshan/backend/rename/CompressUnit.scala",
          "line": 113,
          "end_line": 122,
          "label": "RTL · io.out.isEntryTailLane"
        }
      ]
    }
  ],
  "connections": [
    {
      "id": "rob-compression-step-0",
      "from": "n0",
      "to": "n1",
      "label": "数据 / 控制",
      "variant": "emphasis"
    },
    {
      "id": "rob-compression-step-1",
      "from": "n1",
      "to": "n2",
      "label": "数据 / 控制",
      "variant": "emphasis"
    },
    {
      "id": "rob-compression-step-2",
      "from": "n2",
      "to": "n3",
      "label": "数据 / 控制",
      "variant": "emphasis"
    },
    {
      "id": "rob-compression-step-3",
      "from": "n3",
      "to": "n4",
      "label": "数据 / 控制",
      "variant": "emphasis"
    },
    {
      "id": "rob-compression-step-4",
      "from": "n4",
      "to": "n5",
      "label": "数据 / 控制",
      "variant": "emphasis"
    }
  ],
  "cards": [
    {
      "dot": "cyan",
      "title": "设计职责",
      "items": [
        "架构 valid 与 actualValid 不同，Fusion 不得丢掉被移除 uOP 对应的退休成员。",
        "向量、拆分 uOP、CSR/Fence/AMO、异常/单步等条件禁止压缩。",
        "Simple run/token 和配对 prefix 形成 ROB entry 成员、尾标志和中断安全信息。"
      ]
    },
    {
      "dot": "emerald",
      "title": "图中语义",
      "items": [
        "节点标注实际 RTL 信号或子模块；标记为“逻辑步骤”的框是组合/寄存器操作分组，并非额外硬件实例。",
        "沿连线阅读该模块的数据和控制依赖；流水级、同时执行及握手条件以节点和源码为准，图不是周期精确时序。"
      ]
    },
    {
      "dot": "violet",
      "title": "版本与配置",
      "items": [
        "top.DefaultConfig(1) · OpenLLC；xiangshan @ d48cd2dd7972",
        "角色、接口和状态根据固定 RTL 核实；多实例的同设计复用本页。",
        "实例数量由父模块/参数配置决定；本页描绘单实例的设计。"
      ]
    }
  ]
}
